{"action_id":"official-study-repair-candidate-20260804","analysis_graph_ref":{"byte_count":1173,"media_type":"application/json","relative_path":"inputs/analysis-graph.json","role":"analysis","sha256":"aa4310584d605928e2edcba0828381c97f4aab0e51f115569073b9e22f4a44e4"},"assignment_ref":{"byte_count":664,"media_type":"application/json","relative_path":"inputs/assignment-pending.json","role":"assignment","sha256":"62a2c1bf460f25b13126ceb9eac19cb885294fe8eec2a06860763d1fd9a275fd"},"benchmark_adapter":{"adapter_id":"registered-swe-live-tau2-v1","adapter_manifest_ref":{"byte_count":805,"media_type":"application/json","relative_path":"inputs/benchmark-adapter-manifest.json","role":"adapter","sha256":"479e5a874e72be2cec096459a11dfe87fdd3f8210213595667d59eb7daacd7f2"},"entrypoint":["python3","-m","pneuma_lab.cloud.registered_benchmark_adapter"],"timeout_seconds":1800},"benchmarks":[{"benchmark_id":"swe_multilang","dataset_repository":"SWE-bench-Live/MultiLang","dataset_revision":"608f7ae9ab8ea1f9f0d030fe04562cf6bd1a0c8b","repository":"microsoft/SWE-bench-Live","revision":"70ec57e852e3f2d195790fe71f553e272c691833","task_manifest_sha256":"03ae3f651c0c54380237fb0ff9b929a130c650725a095b4520f0b0a1c714c74a","task_manifest_size_bytes":49286},{"benchmark_id":"tau2","dataset_repository":"sierra-research/tau2-bench","dataset_revision":"fc0055dc4e0a316c3f83133267fbd6faaa770992","repository":"sierra-research/tau2-bench","revision":"fc0055dc4e0a316c3f83133267fbd6faaa770992","task_manifest_sha256":"03ae3f651c0c54380237fb0ff9b929a130c650725a095b4520f0b0a1c714c74a","task_manifest_size_bytes":49286}],"budget":{"max_attempts":1,"max_duration_seconds":1200000,"max_usd":6400.0,"spot_only":true},"code_commit":"c352c9e0e4459c80cddfbf84cce94d0b4c79aaa4","execution_surface_ref":{"byte_count":2187,"media_type":"application/json","relative_path":"evidence/production-surface.json","role":"execution_surface","sha256":"0b401d505368505be161ead2fd54d8016bc7fd12aeabe3b4be3e8f8e93114f35"},"image_bindings":[{"image_digest":"sha256:eb8c8f5bf51e316443212b9e7db57fe9b7596bcf08a6fb00de52f642ad5827cf","role":"controller"},{"image_digest":"sha256:6b175c1d822af623d77a3241c7d0015854881be63c70940733fe8fd5c3a4854f","role":"model-server"},{"image_digest":"sha256:83f87c3f32aa670a433685b97d59f7b6ab927e6de039f1964a2d6b9e177b00d4","role":"benchmark-worker"}],"input_lock_ref":{"byte_count":2993,"media_type":"application/json","relative_path":"inputs/input-lock.json","role":"input_lock","sha256":"7bb584da29f1fb55e5f46133a985bd3c249f154643dad5a3469ae737aee497e7"},"model":{"repository":"Qwen/Qwen3.6-35B-A3B-FP8","revision":"95a723d08a9490559dae23d0cff1d9466213d989","sampling":{"presence_penalty":0.0,"reasoning_parser":"qwen3","repetition_penalty":1.0,"temperature":0.6,"thinking_mode":true,"tool_call_parser":"qwen3_coder","top_k":20,"top_p":0.95},"sampling_by_benchmark":{"swe_multilang":{"presence_penalty":0.0,"reasoning_parser":"qwen3","repetition_penalty":1.0,"temperature":0.6,"thinking_mode":true,"tool_call_parser":"qwen3_coder","top_k":20,"top_p":0.95},"tau2":{"presence_penalty":1.5,"reasoning_parser":"qwen3","repetition_penalty":1.0,"temperature":1.0,"thinking_mode":true,"tool_call_parser":"qwen3_coder","top_k":20,"top_p":0.95}},"serving_engine":"vllm","serving_engine_version":"0.19.0","tokenizer_revision":"95a723d08a9490559dae23d0cff1d9466213d989"},"model_server":{"endpoint":"http://model-server.internal:8000","launch_argv":["python3","-m","vllm.entrypoints.openai.api_server","--model","Qwen/Qwen3.6-35B-A3B-FP8","--revision","95a723d08a9490559dae23d0cff1d9466213d989","--tokenizer","Qwen/Qwen3.6-35B-A3B-FP8","--tokenizer-revision","95a723d08a9490559dae23d0cff1d9466213d989","--reasoning-parser","qwen3","--tool-call-parser","qwen3_coder"],"readiness_timeout_seconds":900,"request_timeout_seconds":900},"official_authorization_ref":null,"official_key_registry_ref":null,"output":{"controller_state_path":"outputs/official-study/controller.json","root":"outputs/official-study","worker_evidence_template":"outputs/official-study/{worker_id}.evidence.json"},"power_report_ref":null,"power_tier":null,"provider_binding_ref":{"byte_count":1087,"media_type":"application/json","relative_path":"inputs/provider-binding.json","role":"provider","sha256":"f3fceeea6678d48e428ebe8cb19b1ae72859d81b597bc83f2a2eba1fe1cf6154"},"record_kind":"cloud_production_run_spec","rng":{"commitment_ref":{"byte_count":770,"media_type":"application/json","relative_path":"inputs/rng-commitment.json","role":"rng","sha256":"bc70bcae9e4d2727e176767100d54ad48dc901bded29e5a27da07f8674975e24"},"contract_id":"official-study-rng-v1","draw_domains":["roster","schedule","assignment","model","benchmark","unblind"],"root_u64":null,"seeds":{},"status":"pending_commitments"},"roster_ref":{"byte_count":1361,"media_type":"application/json","relative_path":"inputs/roster-candidate.json","role":"roster","sha256":"215bd2e7acb352c8d1c0c79dbd4863176fc689b7c450a4afaffcc30bf2e119c6"},"run_mode":"official_candidate","schema_version":"0.1.0","study_id":"neurips-2026-resampling-null","task_manifest_ref":{"byte_count":49286,"media_type":"application/json","relative_path":"inputs/task-registry.json","role":"task_manifest","sha256":"03ae3f651c0c54380237fb0ff9b929a130c650725a095b4520f0b0a1c714c74a"},"worker_topology":{"allocation_contract_id":"canonical-round-robin-two-worker-v1","gpus_per_worker":1,"instance_type":"g6e.2xlarge","vcpus_per_worker":8,"worker_ids":["worker-0","worker-1"]}}
